title,year,budget_millions,loss_millions,Plot,Metascore,imdbRating,Director,Language,omdb_year,match_status,Loss_Category
Sahara,2005,160.0,78.4,"Master explorer Dirk Pitt goes on the adventure of a lifetime of seeking out a lost Civil War battleship known as the ""Ship of Death"" in the deserts of West Africa while helping a WHO doctor being hounded by a ruthless dictator.",41,6.1,Breck Eisner,"English, French, Arabic",2005,Verified,Severe
Seventh Son,2014,95.0,85.0,"When Mother Malkin, the queen of evil witches, escapes the pit she was imprisoned in by professional monster hunter Spook decades ago and kills his apprentice, he recruits young Tom, the seventh son of the seventh son, to help him.",30,5.5,Sergei Bodrov,English,2014,Verified,Severe
Sinbad: Legend of the Seven Seas,2003,60.0,125.0,The sailor of legend is framed by the goddess Eris for the theft of the Book of Peace and must travel to her realm at the end of the world to retrieve it and save the life of his childhood friend Prince Proteus.,48,6.7,"Patrick Gilmore, Tim Johnson","English, Cantonese, Italian",2003,Verified,Catastrophic
Snake Eyes: G.I. Joe Origins,2021,99.0,88.0,,,,,,0,Not Found,Severe
Snow White,2025,270.0,115.0,A princess joins forces with seven dwarfs and a group of rebels to liberate her kingdom from her cruel stepmother the Evil Queen.,50,2.1,Marc Webb,"English, Italian, Turkish",2025,Verified,Catastrophic
Soldier,1998,67.5,60.0,"A soldier trained from birth is deemed obsolete and dumped on a waste planet where he is reluctantly taken in by a community of defenseless, stranded wayfarers.",,6.1,Paul W.S. Anderson,English,1998,Verified,Severe
Solo: A Star Wars Story,2018,250.0,99.5,"During an adventure in the criminal underworld, Han Solo meets his future co-pilot Chewbacca and Lando Calrissian years before joining the Rebel Alliance.",62,6.9,Ron Howard,English,2018,Verified,Severe
Son of the Mask,2005,100.0,70.0,"Tim Avery, an aspiring cartoonist, finds himself in a predicament when his dog stumbles upon the mask of Loki. Then after conceiving an infant son ""born of the mask"", he discovers just how looney child raising can be.",20,2.3,Lawrence Guterman,English,2005,Verified,Severe
Soul,2020,150.0,134.0,"Joe is a middle-school band teacher whose life hasn't quite gone the way he expected. His true passion is jazz. But when he travels to another realm to help someone find their passion, he soon discovers what it means to have soul.",83,8.0,"Pete Docter, Kemp Powers","English, Korean, Inuktitut",2020,Verified,Catastrophic
A Sound of Thunder,2005,80.0,74.0,"A single mistake in the past, by a time travel company in the future, has devastating and unforeseen consequences.",24,4.2,Peter Hyams,"English, Mandarin",2005,Verified,Severe
Space Jam: A New Legacy,2021,150.0,111.0,"A rogue artificial intelligence kidnaps the son of famed basketball player LeBron James, who then has to work with the Looney Tunes to win a basketball game.",36,4.5,Malcolm D. Lee,English,2021,Verified,Catastrophic
Speed Racer,2008,120.0,88.0,"Young driver, Speed Racer, aspires to be champion of the racing world with the help of his family and his high-tech Mach 5 automobile.",37,6.1,"Lana Wachowski, Lilly Wachowski",English,2008,Verified,Severe
Sphere,1998,76.5,61.0,A spaceship is discovered under three hundred years' worth of coral growth at the bottom of the ocean.,35,6.1,Barry Levinson,English,1998,Verified,Severe
Stealth,2005,135.0,96.0,"Deeply ensconced in a top-secret military program, three pilots struggle to bring an artificial intelligence program under control before it initiates the next world war.",35,5.1,Rob Cohen,"English, Korean, Russian, Spanish",2005,Verified,Severe
Strange World,2022,180.0,187.5,The legendary Clades are a family of explorers whose differences threaten to topple their latest and most crucial mission.,65,5.7,"Don Hall, Qui Nguyen",English,2022,Verified,Catastrophic
The Suicide Squad,2021,185.0,119.0,"Supervillains Harley Quinn, Bloodsport, Peacemaker, and a collection of nutty cons at Belle Reve prison join the super-secret, super-shady Task Force X as they are dropped off at the remote, enemy-infused island of Corto Maltese.",72,7.2,James Gunn,"English, Spanish, Japanese, Cantonese",2021,Verified,Catastrophic
Supernova,2000,90.0,83.0,A deep space rescue and recovery spaceship with a crew of 6 receives a distress call from a mining operation 3432 light years away. A rescue operation via dimension jump is made. Bad idea.,19,4.9,"Walter Hill, Francis Ford Coppola, Jack Sholder",English,2000,Verified,Severe
Tenet,2020,200.0,75.0,"Armed with only the word ""Tenet,"" and fighting for the survival of the entire world, CIA operative, The Protagonist, journeys through a twilight world of international espionage on a global mission that unfolds beyond real time.",69,7.3,Christopher Nolan,English,2020,Verified,Severe
Terminator: Dark Fate,2019,190.5,120.0,"An augmented human and Sarah Connor must stop an advanced liquid Terminator from hunting down a young girl, whose fate is critical to the human race.",54,6.2,Tim Miller,"English, Spanish",2019,Verified,Catastrophic
Timeline,2003,80.0,66.6,"A group of archaeologists get embroiled in an adventure where they must travel back in time to 14th Century France, to save their professor before the French battle the English at Castlegard. If they fail, they won't be able to re...",29,5.6,Richard Donner,"English, French",2003,Verified,Severe
Titan A.E.,2000,82.5,100.0,A young man learns that he has to find a hidden Earth ship before an enemy alien species does in order to secure the survival of humanity.,48,6.6,"Don Bluth, Gary Goldman","English, Mandarin",2000,Verified,Catastrophic
Tomorrowland,2015,185.0,120.0,"Bound by a shared destiny, a teen bursting with scientific curiosity and a former boy-genius inventor embark on a mission to unearth the secrets of a place somewhere in time and space that exists in their collective memory.",60,6.4,Brad Bird,"English, French, Japanese",2015,Verified,Catastrophic
Town & Country,2001,90.0,85.0,Two loving middle aged couples get caught in a series of marital misadventures over reasons of fidelity.,34,4.5,Peter Chelsom,English,2001,Verified,Severe
Transformers: The Last Knight,2017,238.5,100.0,"A deadly threat from Earth's history reappears and a hunt for a lost artifact takes place between Autobots and Decepticons, while Optimus Prime encounters his creator in space.",27,5.2,Michael Bay,English,2017,Verified,Catastrophic
Treasure Planet,2002,140.0,85.0,"Jim Hawkins is a teenager who finds the map of a great treasure hidden by a space pirate. Together with some friends, he sets off in a large spaceship, shaped like a caravel, on his quest.",60,7.2,"Ron Clements, John Musker",English,2002,Verified,Severe
Tron: Ares,2025,220.0,132.7,"A highly sophisticated program, Ares, is sent from the digital world into the real world on a dangerous mission.",48,6.3,Joachim Rønning,English,2025,Verified,Catastrophic
Turning Red,2022,175.0,173.0,"A thirteen-year-old girl named Mei Lee is torn between staying her mother's dutiful daughter and the changes of adolescence. And as if the challenges were not enough, whenever she gets overly excited Mei transforms into a giant re...",83,6.9,Domee Shi,"English, Cantonese, Korean",2022,Verified,Catastrophic
Valerian and the City of a Thousand Planets,2017,178.6,82.0,"A dark force threatens Alpha, a vast metropolis and home to species from a thousand planets. Special operatives Valerian and Laureline must race to identify the marauding menace and safeguard not just Alpha, but the future of the ...",51,6.4,Luc Besson,English,2017,Verified,Severe
West Side Story,2021,100.0,104.0,"Two youngsters from rival New York City gangs fall in love, but tensions between their respective friends build toward tragedy.",86,7.6,"Jerome Robbins, Robert Wise","English, Spanish",1961,Mismatch,Catastrophic
Wild Wild West,1999,170.0,66.2,"The two best special agents in the Wild West must save President Grant from the clutches of a diabolical, wheelchair-bound, steampunk-savvy, Confederate scientist bent on revenge for losing the Civil War.",40,4.9,Barry Sonnenfeld,English,1999,Verified,Severe
Windtalkers,2002,117.5,78.5,Two U.S. Marines in World War II are assigned to protect the Navajo Marines who use their native language as an unbreakable radio cipher.,51,6.1,John Woo,"English, Navajo, Japanese",2002,Verified,Severe
Wish,2023,200.0,125.0,A young girl wishes on a star and gets a more direct answer than she bargained for when a trouble-making star comes down from the sky to join her.,47,5.6,"Chris Buck, Fawn Veerasunthorn",English,2023,Verified,Catastrophic
The Wolfman,2010,150.0,76.0,"Upon his return to his ancestral homeland, an American man is bitten and subsequently cursed by a werewolf.",43,5.9,Joe Johnston,"English, Romany, Romanian, Ukrainian",2010,Verified,Severe
Wonder Woman 1984,2020,200.0,117.5,"Wonder Woman finds herself battling two opponents, Maxwell Lord, a shrewd entrepreneur, and Barbara Minerva, a friend-turned-foe. Meanwhile, she also ends up crossing paths with her love interest.",60,5.3,Patty Jenkins,"English, Arabic, Russian, Mandarin",2020,Verified,Catastrophic
A Wrinkle in Time,2018,125.0,130.6,"After the disappearance of her scientist father, three peculiar beings send Meg, her brother, and her friend to space in order to find him.",53,4.3,Ava DuVernay,English,2018,Verified,Catastrophic
xXx: State of the Union,2005,113.1,78.0,"Darius Stone, a new agent in the xXx program, is sent to Washington, D.C. to stop a coup attempt against the President of the United States.",37,4.5,Lee Tamahori,English,2005,Verified,Severe
Zoom,2006,75.6,69.0,Former superhero Jack is called back to work to transform an unlikely group of ragtag kids into superheroes at a private academy.,26,4.4,Peter Hewitt,English,2006,Verified,Severe
